name,platform,release_date,summary,user_review
Red Dead Redemption 2, Xbox One,"October 26, 2018","Developed by the creators of Grand Theft Auto V and Red Dead Redemption, Red Dead Redemption 2 is an epic tale of life in America’s unforgiving heartland. The game’s vast and atmospheric world also provides the foundation for a brand new online multiplayer experience. America, 1899. The end of the Wild West era has begun. After a robbery goes badly wrong in the western town of Blackwater, Arthur Morgan and the Van der Linde gang are forced to flee. With federal agents and the best bounty hunters in the nation massing on their heels, the gang has to rob, steal and fight their way across the rugged heartland of America in order to survive. As deepening internal fissures threaten to tear the gang apart, Arthur must make a choice between his own ideals and loyalty to the gang that raised him. [Rockstar]",8.0
Grand Theft Auto V, Xbox One,"November 18, 2014","Grand Theft Auto 5 melds storytelling and gameplay in unique ways as players repeatedly jump in and out of the lives of the game's three protagonists, playing all sides of the game's interwoven story.",7.9
Grand Theft Auto V, PlayStation 3,"September 17, 2013","Los Santos is a vast, sun-soaked metropolis full of self-help gurus, starlets and once-important, formerly-known-as celebrities. The city was once the envy of the Western world, but is now struggling to stay afloat in an era of economic uncertainty and reality TV. Amidst the chaos, three unique criminals plot their own chances of survival and success: Franklin, a former street gangster in search of real opportunities and serious cheddar; Michael, a professional ex-con whose retirement is a lot less rosy than he hoped it would be; and Trevor, a violent maniac driven by the chance of a cheap high and the next big score. Quickly running out of options, the crew risks it all in a sequence of daring and dangerous heists that could set them up for life.",8.3
Grand Theft Auto V, Xbox 360,"September 17, 2013","Los Santos is a sprawling sun-soaked metropolis full of self-help gurus, starlets and once-important stars. The city was once the envy of the Western world, but is now struggling to stay relevant in an era of economic uncertainty and reality TV. Amidst the chaos, three very different criminals chart their own chances of survival and success: Franklin, a former street gangster, now looking for real opportunities and fat stacks of cash; Michael, a professional ex-con whose retirement is significantly less rosy than he hoped it would be; and Trevor, a violent maniac driven by the chance of a cheap high and the next big score. Rapidly running out of options, the crew risks everything in a series of bolt and dangerous heists that could set them up for the long haul.",8.3
Red Dead Redemption 2, PlayStation 4,"October 26, 2018","Developed by the creators of Grand Theft Auto V and Red Dead Redemption, Red Dead Redemption 2 is an epic tale of life in America’s unforgiving heartland. The game’s vast and atmospheric world also provides the foundation for a brand new online multiplayer experience. America, 1899. The end of the Wild West era has begun. After a robbery goes badly wrong in the western town of Blackwater, Arthur Morgan and the Van der Linde gang are forced to flee. With federal agents and the best bounty hunters in the nation massing on their heels, the gang has to rob, steal and fight their way across the rugged heartland of America in order to survive. As deepening internal fissures threaten to tear the gang apart, Arthur must make a choice between his own ideals and loyalty to the gang that raised him. [Rockstar]",8.5
Grand Theft Auto V, PlayStation 4,"November 18, 2014","The sprawling sun-soaked metropolis of Los Santos is chock full of self-help coaches, starlets and C-List celebrities, once on top of the media world, now struggling to stay relevant in time of economic malaise and lowest-common-denominator reality TV. Amidst this madness, three unique criminals plan their own chances of survival and success: Franklin, a street-level hustler in search of opportunities for serious money; Michael, an ex-con whose ""retirement"" is a less rosy than he hoped it would be; and Trevor, a violent dude driven by the chance for a quick high and the next big score. Nearly out of options, the crew risks it all in a series of daring and dangerous heists that could set them up for life - one way or the other.",8.4
Grand Theft Auto V, PC,"April 13, 2015","Los Santos: a sprawling sun-soaked metropolis full of self-help gurus, starlets and fading celebrities, once the envy of the Western world, now struggling to stay alive in a time of economic uncertainty and cheap reality TV. Amidst the turmoil, three very unique criminals plot their own chances of survival and success: Franklin, a street hustler looking for tangible opportunities and serious money; Michael, a professional ex-con whose retirement is less rosy than he figured it would be; and Trevor, a violent dude driven by the opportunity for a cheap high and his next big score. With options at a premium, the crew risks it all in a myriad of daring and dangerous heists that could set them up for life.",7.8
Red Dead Redemption 2, PC,"November 5, 2019","America, 1899. The end of the wild west era has begun as lawmen hunt down the last remaining outlaw gangs. Those who will not surrender or succumb are killed. After a robbery goes badly wrong in the western town of Blackwater, Arthur Morgan and the Van der Linde gang are forced to flee. With federal agents and the best bounty hunters in the nation massing on their heels, the gang must rob, steal and fight their way across the rugged heartland of America in order to survive. As deepening internal divisions threaten to tear the gang apart, Arthur must make a choice between his own ideals and loyalty to the gang who raised him. From the creators of Grand Theft Auto V and Red Dead Redemption, Red Dead Redemption 2 is an epic tale of life in America at the dawn of the modern age.",6.2
Grand Theft Auto Online, Xbox 360,"October 1, 2013","Grand Theft Auto Online is a dynamic and persistent online world for SIXTEEN players that begins by sharing gameplay features, geography and mechanics with Grand Theft Auto V, but continues to expand and evolve with new content created by Rockstar Games and the Grand Theft Auto community. Grand Theft Auto Online takes the fundamental Grand Theft Auto concepts of freedom, ambient activity and mission-based gameplay and makes them available to multiple players in a detailed and responsive online world. In GTA Online, players have the freedom to explore alone or with friends, work cooperatively to complete missions, come together to participate in activities and ambient events, or compete in traditional game modes with the larger community, all with the personality and refined mechanics of Grand Theft Auto V. Players can invest in their character through customizing their appearance, improving their stats, owning customized vehicles, purchasing personal property, and taking part in missions, jobs and activities to earn reputation and cash to open up new opportunities to rise through the criminal ranks. The world of Grand Theft Auto Online will constantly grow and change as new content is added, creating the first ever persistent and dynamic Grand Theft Auto game world. Access to Grand Theft Auto Online is free with every retail copy of Grand Theft Auto V. [Rockstar Games]",5.8